{
  "schema_version": "1.1",
  "api_version": "1",
  "id": "verse-structure",
  "namespace": "verse",
  "version": "1.1.0-alpha",
  "extends": "pse-core",
  "capabilities": [
    "verse-structure",
    "stanzas",
    "verse-lines",
    "stable-verse-ids"
  ],
  "requires_capabilities": [],
  "build_tools": [],
  "required_fonts": [],
  "depends_on": [],
  "conflicts_with": [],
  "compatible_profiles": [
    "*"
  ],
  "qa_hooks": [],
  "description": "Generic verse semantics with stable stanza and line identifiers independent of page design, indentation, and line numbering."
}
