{
  "schema_version": "1.1",
  "api_version": "1",
  "id": "parallel-text",
  "namespace": "parallel",
  "version": "1.7.0-alpha",
  "extends": "pse-core",
  "capabilities": [
    "parallel-text",
    "stable-segment-ids",
    "segment-alignment",
    "alignment-locators",
    "typed-alignment-notes",
    "translation-note-linkage",
    "presentation-mode-independence"
  ],
  "requires_capabilities": [],
  "build_tools": [],
  "required_fonts": [],
  "depends_on": [],
  "conflicts_with": [],
  "compatible_profiles": [
    "*"
  ],
  "qa_hooks": [
    "parallel-text-contract"
  ],
  "description": "Generic source/target segment semantics with stable alignment relations, optional alignment locators and typed notes, independent of visual presentation mode."
}
