{
  "schema_version": "1.1",
  "api_version": "1",
  "id": "drama-structure",
  "namespace": "drama",
  "version": "1.4.0-alpha",
  "extends": "pse-core",
  "capabilities": [
    "drama-structure",
    "speaker-registry",
    "speeches",
    "stage-directions",
    "act-scene-structure"
  ],
  "requires_capabilities": [],
  "build_tools": [],
  "required_fonts": [],
  "depends_on": [],
  "conflicts_with": [],
  "compatible_profiles": [
    "*"
  ],
  "qa_hooks": [
    "drama-contract"
  ],
  "description": "Generic drama semantics: stable speaker registry, speeches, stage directions, and act/scene structure independent of visual style."
}
