{
  "schema_version": "1.1",
  "api_version": "1",
  "id": "dramatic-locators",
  "namespace": "drama.locators",
  "version": "1.3.0-alpha",
  "extends": "pse-core",
  "capabilities": [
    "dramatic-locators"
  ],
  "requires_capabilities": [
    "canonical-locators"
  ],
  "build_tools": [],
  "required_fonts": [],
  "depends_on": [
    "canonical-locators"
  ],
  "conflicts_with": [],
  "compatible_profiles": [
    "*"
  ],
  "qa_hooks": [
    "locator-contract"
  ],
  "description": "Optional dramatic line/segment locator helpers implemented through the generic namespaced locator contract."
}
