{
  "schema_version": "1.1",
  "id": "apparatus",
  "version": "1.3.0-alpha",
  "extends": "pse-core",
  "capabilities": [
    "apparatus",
    "apparatus-ranges",
    "explanatory-notes",
    "multi-stream-apparatus",
    "apparatus-stream-label-presentation"
  ],
  "build_tools": [],
  "required_fonts": [],
  "description": "Generic scholarly apparatus primitives keyed to canonical locators, with semantic streams separated from presentation labels.",
  "depends_on": [
    "canonical-locators"
  ],
  "api_version": "1",
  "namespace": "apparatus",
  "requires_capabilities": [
    "canonical-locators"
  ],
  "conflicts_with": [],
  "compatible_profiles": [
    "*"
  ],
  "qa_hooks": []
}
